{
  "schema_version": "1.0",
  "feed_id": "ti-daily-top10",
  "feed_name": "Daily Threat Intelligence Output - Top 10 Vulnerabilities and Cyber Incidents",
  "report": {
    "check_performed_at": "2026-10-30T10:45:00Z",
    "check_performed_at_local": "2026-10-30",
    "timezone": "UTC",
    "coverage_window": {
      "start": "2026-10-29T10:45:00Z",
      "end": "2026-10-30T10:45:00Z",
      "duration_hours": 24.0,
      "note": "UK-focused run. No new confirmed UK government compromise or newly dated UK incident found in the window; search returned nothing dated 29-30 Oct. PHP2Shell remains the top item (KEV-listed 26 Oct; no confirmed compromise of central government systems; a minister said Budget security was not breached). Remaining entries are carry-overs unchanged."
    },
    "entry_count": 10,
    "generated_by": "scheduled-claude-research",
    "next_check_due": "2026-10-31T10:45:00Z"
  },
  "collection_metadata": {
    "collection_method": "open-source web search aggregation (search snippets only)",
    "limitations": [
      "Direct page fetches (ncsc.gov.uk, bleepingcomputer.com and others) failed in this environment; content is drawn from search-result summaries and may be inaccurate. Verify against primary sources.",
      "Search surfaced little dated within the last 24 hours; several results had unreliable date metadata. No UK government incident confirmed in the window.",
      "Attribution statements (ShinyHunters, Russian-speaking actors) are press reports, not confirmed.",
      "KQL queries are untested hunting starting points; validate table availability and tune before use.",
      "Citrix indicator values are relayed from secondary sources; use vendor IoC tooling for full lists.",
      "2026-10-14 run: only search-result summaries were used; ASOS details (Xuanyewen/Simon AI/Snowflake claims, record counts) differ between outlets and are unverified.",
      "2026-10-15 run: search-result summaries only; CVE-2026-0322 and the Ivanti/Ahsay details could not be verified against vendor or CISA primary pages; dates in some results were unreliable.",
      "2026-10-16 run: search-result summaries only (page fetches blocked); Legal Aid, Bristol and Bromcom details are secondary-source and unverified; no new UK government incident first reported inside the window was confirmed.",
      "2026-10-17 run: search-result summaries only; BeyondTrust CVE-2026-102764 vendor/product is disputed between sources (BeyondTrust vs Fortinet) and the CISA alert was not retrieved; no new UK government incident confirmed in the window.",
      "2026-10-18 run: search-result summaries only; nothing new dated within the window was found, so entries are carry-overs and their details remain secondary-source and unverified.",
      "2026-10-19 run: search-result summaries only; nothing new dated within the window was found, so entries are carry-overs and remain secondary-source and unverified.",
      "2026-10-20 run: search-result summaries only (page fetches failed); nothing new dated within the window was found, so entries are carry-overs and remain secondary-source and unverified.",
      "2026-10-21 run: search-result summaries only; nothing new dated within the window was found, so entries are carry-overs and remain secondary-source and unverified.",
      "2026-10-22 run: search-result summaries only (cisa.gov fetch failed); PHP2Shell details are from press reports and unverified against NCSC/PHP primary advisories.",
      "2026-10-23 run: search-result summaries only; PHP2Shell exploitation claims are from vendor blogs/press (watchTowr, Patchstack, Aikido, Cloudflare) and KEV status could not be confirmed; no new UK incident dated within the window was found, so other entries are carry-overs.",
      "2026-10-24 run: search-result summaries only (cisa.gov fetch failed); Collabora/Nextcloud KEV details come from search snippets and third-party reports; no new UK incident dated within the window was found, so other entries are carry-overs.",
      "2026-10-25 run: search-result summaries only; nothing new dated within the window for UK government was found. PHP2Shell exploitation reports conflict between vendors (Amazon/watchTowr/Cloudflare/SecurityWeek report attacks; The Hacker News/Tanium note mostly probing and unproven public exploit code). Verify KEV status directly.",
      "2026-10-26 run: search-result summaries only; nothing new dated within the window for UK government or UK corporates was found, so entries are carry-overs. Arista VeloCloud Orchestrator CVE/KEV date conflicts between sources and was excluded. Verify KEV status for PHP2Shell directly.",
      "2026-10-27 run: search-result summaries only (cisa.gov fetch failed); PHP2Shell KEV addition on 26 Oct is from search snippets and the KEV due date was not retrieved; no new UK government or UK corporate incident confirmed in the window.",
      "2026-10-28 run: search-result summaries only; HMICFRS/Record details are secondary and unverified; Adobe CVE-2026-48356 KEV status could not be corroborated.",
      "2026-10-29 run: search-result summaries only; nothing new dated within the window was found, so entries are carry-overs and remain secondary-source and unverified. Reports that a Baroness Lloyd Lords statement cited 32 unavailable central government services come via search summary only.",
      "2026-10-30 run: search-result summaries only; nothing new dated within the window was found, so entries are carry-overs and remain secondary-source and unverified."
    ],
    "confidence_legend": {
      "high": "Corroborated by the vendor advisory or by multiple independent reputable sources.",
      "medium": "Reported by a single reputable source, or by secondary coverage of a primary source not directly accessible.",
      "low": "Single-sourced and uncorroborated; treat as an investigative lead only."
    },
    "exploitation_status_values": [
      "exploited_in_the_wild",
      "exploitation_attempts_reported_unconfirmed",
      "public_poc_available",
      "no_known_exploitation"
    ],
    "kql_platform_values": [
      "sentinel",
      "defender_xdr"
    ],
    "ioc_types_present": [
      "actor",
      "filepath",
      "malware",
      "ttp"
    ]
  },
  "vulnerabilities": [
    {
      "rank": 1,
      "id": "TI-2026-10-22-001",
      "title": "'PHP2Shell' Critical PHP Flaws (CVE-2026-109618, CVE-2026-109619) - NCSC Patch-or-Isolate Alert Forces UK Councils, NHS Boards and Met Police Sites Offline",
      "cve_ids": [
        "CVE-2026-109618",
        "CVE-2026-109619"
      ],
      "vendor": "PHP Group",
      "affected_products": [
        "PHP (unpatched supported branches; check php.net advisory for exact versions)"
      ],
      "category": "vulnerability",
      "cvss_v3": 9.2,
      "severity": "critical",
      "exploitation_status": "exploited_in_the_wild",
      "kev_listed": true,
      "kev_due_date": null,
      "patch_available": "yes",
      "first_reported": "2026-10-21",
      "last_updated": "2026-10-30",
      "confidence": "medium",